{
  "recordType": "owner_daily_ledger",
  "phaseRange": "Phase1621-1650AIO",
  "date": "YYYY-MM-DD",
  "taskId": "",
  "taskTitle": "",
  "taskCategory": "",
  "taskInputSummary": "",
  "modeUsed": "normal",
  "missionControlPath": "",
  "contextGatewayUsed": false,
  "conceptFieldVisible": false,
  "evidenceReplayUsed": false,
  "securityShieldTriggered": false,
  "providerCallUsed": false,
  "providerRef": "",
  "estimatedTokenSaving": 0,
  "ownerPerceivedUsefulness": null,
  "ownerPerceivedSpeed": null,
  "ownerPerceivedClarity": null,
  "ownerTrustLevel": null,
  "failureOccurred": false,
  "frictionPoint": "",
  "confusingArea": "",
  "desiredFix": "",
  "keepUsingTomorrow": null,
  "ownerManualNote": "",
  "timestamp": "",
  "evidencePath": "",
  "browserScreenshotPath": "",
  "verifierResultPath": "",
  "tokenSavingComputed": 0,
  "routeAffinityScore": 0,
  "evidenceCoherenceScore": 0,
  "surpriseScore": 0,
  "riskFieldScore": 0,
  "localHealthCheckResult": "",
  "regressionResult": "",
  "ownerRecorded": false,
  "automatedTaskRun": false,
  "automatedBrowserWalkthrough": false,
  "automatedScreenshotCaptured": false,
  "automatedTokenSavingMeasured": false,
  "automatedFailureDetected": false,
  "automatedRegressionExecuted": false,
  "automatedEvidenceNotClaimedAsHuman": true,
  "ownerManualFeedback": false,
  "realHumanFeedbackCollected": false,
  "dogfoodingCompleted": false,
  "providerCallsMade": false,
  "entries": []
}
